id:ID(KG),:LABEL,name,description,xref,provided_by,source
UMLS:C4267988,Disease,"Drug or Chemical Induced Diabetes Mellitus with Proliferative Diabetic Retinopathy with Traction Retinal Detachment not Involving the Macula, Right Eye",Evidence of drug or chemical induced diabetes mellitus with proliferative diabetic retinopathy with traction retinal detachment not involving the macula in the right eye.,,NCBI:MedGen,NCBI MedGen
UMLS:C4268139,Disease,"Other Specified Diabetes Mellitus with Moderate Nonproliferative Diabetic Retinopathy without Macular Edema, Bilateral",Evidence of other specified diabetes mellitus with moderate nonproliferative diabetic retinopathy without macular edema that is bilateral not specified elsewhere.,,NCBI:MedGen,NCBI MedGen
UMLS:C4268155,Disease,"Other Specified Diabetes Mellitus with Proliferative Diabetic Retinopathy with Traction Retinal Detachment Involving the Macula, Left Eye",Evidence of other specified diabetes mellitus with proliferative diabetic retinopathy with traction retinal detachment involving the macula in the left eye not specified elsewhere.,,NCBI:MedGen,NCBI MedGen
UMLS:C2873960,Disease,Drug or Chemical Induced Diabetes Mellitus with Diabetic Chronic Kidney Disease,Evidence of drug or chemical induced diabetes mellitus with diabetic chronic kidney disease.,,NCBI:MedGen,NCBI MedGen
UMLS:C4268034,Disease,"Type 1 Diabetes Mellitus with Severe Nonproliferative Diabetic Retinopathy without Macular Edema, Unspecified Eye",Evidence of type 1 diabetes mellitus with severe nonproliferative diabetic retinopathy without macular edema in an unspecified eye.,,NCBI:MedGen,NCBI MedGen
MONDO:0011448,Disease,PPARG-related familial partial lipodystrophy,Familial partial lipodystrophy type 3 (FPLD3) is an autosomal dominant disorder characterized by marked loss of subcutaneous fat from the extremities. Calves and lower arms appear prominently muscular,UMLS:C1720861,NCBI:MedGen,NCBI MedGen
UMLS:C4268172,Disease,"Other Specified Diabetes Mellitus with Stable Proliferative Diabetic Retinopathy, Unspecified Eye","Evidence of other specified diabetes mellitus with stable proliferative diabetic retinopathy, unspecified eye not specified elsewhere.",,NCBI:MedGen,NCBI MedGen
UMLS:C2903676,Disease,Unspecified Pre-Existing Diabetes Mellitus in the Puerperium,Evidence of unspecified pre-existing diabetes mellitus in the puerperium.,,NCBI:MedGen,NCBI MedGen
MONDO:0017184,Disease,Autosomal dominant hyperinsulinism due to SUR1 deficiency,"A form of congenital diazoxide-sensitive diffuse hyperinsulinism due to ABCC8 variants and characterized by hypoglycemic episodes that are usually mild, escaping detection during infancy, and usually ",UMLS:C4274080,NCBI:MedGen,NCBI MedGen
MONDO:0012192,Disease,Permanent neonatal diabetes mellitus-pancreatic and cerebellar agenesis syndrome,Permanent neonatal diabetes mellitus-pancreatic and cerebellar agenesis syndrome is characterized by neonatal diabetes mellitus associated with cerebellar and/or pancreatic agenesis.,UMLS:C1836780,NCBI:MedGen,NCBI MedGen
UMLS:C4267929,Disease,"Diabetes Mellitus due to Underlying Condition with Proliferative Diabetic Retinopathy with Traction Retinal Detachment Involving the Macula, Unspecified Eye",Evidence of diabetes mellitus due to underlying condition with proliferative diabetic retinopathy with traction retinal detachment involving the macula in an unspecified eye.,,NCBI:MedGen,NCBI MedGen
MONDO:0014943,Disease,Mitochondrial DNA depletion syndrome 15 (hepatocerebral type),Any mitochondrial DNA depletion syndrome in which the cause of the disease is a mutation in the TFAM gene.,UMLS:C4310690,NCBI:MedGen,NCBI MedGen
UMLS:C5923912,Disease,Hypertension in chronic kidney disease stage 4 due to type 1 diabetes mellitus,,,NCBI:MedGen,NCBI MedGen
MONDO:0976265,Disease,"Neurodevelopmental disorder with poor growth, seizures, and brain abnormalities","Neurodevelopmental disorder with poor growth, seizures, and brain abnormalities (NEDGSB) is an autosomal recessive disorder characterized by poor overall growth with short stature and microcephaly, mo",UMLS:C6012710,NCBI:MedGen,NCBI MedGen
UMLS:C4268037,Disease,"Type 1 Diabetes Mellitus with Proliferative Diabetic Retinopathy with Macular Edema, Bilateral",Evidence of type 1 diabetes mellitus with proliferative diabetic retinopathy with macular edema that is bilateral.,,NCBI:MedGen,NCBI MedGen
UMLS:C2873992,Disease,Drug or Chemical Induced Diabetes Mellitus with Diabetic Peripheral Angiopathy without Gangrene,Evidence of drug or chemical induced diabetes mellitus with diabetic peripheral angiopathy without gangrene.,,NCBI:MedGen,NCBI MedGen
UMLS:C4268074,Disease,"Type 2 Diabetes Mellitus with Mild Nonproliferative Diabetic Retinopathy without Macular Edema, Bilateral",Evidence of type 2 diabetes mellitus with mild nonproliferative diabetic retinopathy without macular edema that is bilateral.,,NCBI:MedGen,NCBI MedGen
MONDO:0014553,Disease,Tenorio syndrome,"Tenorio syndrome (TNORS) is characterized by overgrowth, macrocephaly, and impaired intellectual development. Some patients may have mild hydrocephaly, hypoglycemia, and inflammatory diseases resembli",UMLS:C4015710,NCBI:MedGen,NCBI MedGen
MONDO:0971174,Disease,Multiple mitochondrial dysfunctions syndrome 9b,"Multiple mitochondrial dysfunctions syndrome-9B (MMDS9B) is characterized by optic atrophy and/or auditory neuropathy variably associated with developmental delay or regression, global hypotonia, pyra",UMLS:C5935635,NCBI:MedGen,NCBI MedGen
UMLS:C4687170,Disease,"Grade 5 Hypoglycemia, CTCAE",Death,,NCBI:MedGen,NCBI MedGen
UMLS:C2874164,Disease,Other Specified Diabetes Mellitus with Other Diabetic Arthropathy,Evidence of other specified diabetes mellitus with other diabetic arthropathy not specified elsewhere.,,NCBI:MedGen,NCBI MedGen
MONDO:0014437,Disease,Bardet-Biedl syndrome 9,"Bardet-Biedl syndrome-9 (BBS9) is an autosomal recessive disorder characterized by obesity, polydactyly, renal anomalies, retinopathy, and impaired intellectual development (Abu-Safieh et al., 2012). ",UMLS:C1859567,NCBI:MedGen,NCBI MedGen
UMLS:C4268174,Disease,"Other Specified Diabetes Mellitus with Proliferative Diabetic Retinopathy without Macular Edema, Left Eye",Evidence of other specified diabetes mellitus with proliferative diabetic retinopathy without macular edema in the left eye not specified elsewhere.,,NCBI:MedGen,NCBI MedGen
UMLS:C2874062,Disease,Type 1 Diabetes Mellitus with Foot Ulcer,Evidence of type 1 diabetes mellitus with foot ulcer.,,NCBI:MedGen,NCBI MedGen
UMLS:C4268118,Disease,"Type 2 Diabetes Mellitus with Proliferative Diabetic Retinopathy without Macular Edema, Bilateral",Evidence of type 2 diabetes mellitus with proliferative diabetic retinopathy without macular edema that is bilateral.,,NCBI:MedGen,NCBI MedGen
UMLS:C4267938,Disease,"Diabetes Mellitus due to Underlying Condition with Proliferative Diabetic Retinopathy with Combined Traction Retinal Detachment and Rhegmatogenous Retinal Detachment, Bilateral",Evidence of diabetes mellitus due to underlying condition with proliferative diabetic retinopathy with combined traction retinal detachment and rhegmatogenous retinal detachment that is bilateral.,,NCBI:MedGen,NCBI MedGen
UMLS:C4268154,Disease,"Other Specified Diabetes Mellitus with Proliferative Diabetic Retinopathy with Traction Retinal Detachment Involving the Macula, Right Eye",Evidence of other specified diabetes mellitus with proliferative diabetic retinopathy with traction retinal detachment involving the macula in the right eye not specified elsewhere.,,NCBI:MedGen,NCBI MedGen
MONDO:0016482,Disease,Silver-Russell syndrome due to maternal uniparental disomy of chromosome 11,"Other features can include the delayed development of motor skills, speech and language problems, and learning disabilities.\n\nSilver-Russell syndrome is a rare disorder that is characterized by slow",UMLS:C5679841,NCBI:MedGen,NCBI MedGen
UMLS:C4267978,Disease,"Drug or Chemical Induced Diabetes Mellitus with Proliferative Diabetic Retinopathy with Macular Edema, Right Eye",Evidence of drug or chemical induced diabetes mellitus with proliferative diabetic retinopathy with macular edema in the right eye.,,NCBI:MedGen,NCBI MedGen
UMLS:C2903659,Disease,"Pre-Existing Type 1 Diabetes Mellitus, in Pregnancy, First Trimester",Evidence of pre-existing type 1 diabetes mellitus in the in pregnancy in the first trimester.,,NCBI:MedGen,NCBI MedGen
UMLS:C1849799,Disease,Fasting hypoglycemia (early in disease course),,,NCBI:MedGen,NCBI MedGen
UMLS:C5786254,Disease,"Drug or Chemical Induced Diabetes Mellitus with Mild Non-Proliferative Diabetic Retinopathy without Macular Edema, Bilateral",Evidence of drug or chemical induced diabetes mellitus with mild non-proliferative diabetic retinopathy without macular edema that is bilateral.,,NCBI:MedGen,NCBI MedGen
UMLS:C4268125,Disease,"Other Specified Diabetes Mellitus with Mild Nonproliferative Diabetic Retinopathy with Macular Edema, Right Eye",Evidence of other specified diabetes mellitus with mild nonproliferative diabetic retinopathy with macular edema in the right eye not specified elsewhere.,,NCBI:MedGen,NCBI MedGen
UMLS:C2873999,Disease,Drug or Chemical Induced Diabetes Mellitus with Other Diabetic Arthropathy,Evidence of drug or chemical induced diabetes mellitus with other diabetic arthropathy.,,NCBI:MedGen,NCBI MedGen
UMLS:C0271711,Disease,Spontaneous hypoglycemia,,,NCBI:MedGen,NCBI MedGen
UMLS:C5786263,Disease,"Drug or Chemical Induced Diabetes Mellitus with Moderate Non-Proliferative Diabetic Retinopathy without Macular Edema, Left Eye",Evidence of drug or chemical induced diabetes mellitus with moderate non-proliferative diabetic retinopathy without macular edema in the left eye.,,NCBI:MedGen,NCBI MedGen
UMLS:C1853945,Disease,Elevated plasma galactose (galactosemia),,,NCBI:MedGen,NCBI MedGen
MONDO:0008728,Disease,Classic congenital adrenal hyperplasia due to 21-hydroxylase deficiency,A form of congenital adrenal hyperplasia (CAH) characterized by simple virilizing or salt wasting forms that can manifest with abnormal genital development with variable levels of virilization in fema,UMLS:C4273964,NCBI:MedGen,NCBI MedGen
UMLS:C2874049,Disease,Type 1 Diabetes Mellitus with Diabetic Amyotrophy,Evidence of type 1 diabetes mellitus with diabetic amyotrophy.,,NCBI:MedGen,NCBI MedGen
UMLS:C5923913,Disease,Chronic kidney disease stage 3B due to type 2 diabetes mellitus,,,NCBI:MedGen,NCBI MedGen
MONDO:0033642,Disease,Neurodevelopmental disorder with alopecia and brain abnormalities,"Bachmann-Bupp syndrome (BABS) is characterized by a distinctive type of alopecia, global developmental delay in the moderate to severe range, hypotonia, nonspecific dysmorphic features, behavioral abn",UMLS:C5436741,NCBI:MedGen,NCBI MedGen
MONDO:0008731,Disease,Familial adrenal hypoplasia with absent pituitary luteinizing hormone,Familial adrenal hypoplasia with absent pituitary luteinizing hormone is a rare endocrine disease characterized by a miniature adult type of congenital adrenal hypoplasia (residual adrenal cortex is c,UMLS:C1859978,NCBI:MedGen,NCBI MedGen
UMLS:C2874082,Disease,Type 2 Diabetes Mellitus with Unspecified Diabetic Retinopathy without Macular Edema,Evidence of type 2 diabetes mellitus with unspecified diabetic retinopathy without macular edema.,,NCBI:MedGen,NCBI MedGen
UMLS:C1300107,Disease,"Patient death or serious disability associated with hypoglycemia, the onset of which occurs while the patient is being cared for in a healthcare facility",,,NCBI:MedGen,NCBI MedGen
UMLS:C0475719,Disease,Transient neonatal hyperglycemia,,,NCBI:MedGen,NCBI MedGen
MONDO:0014227,Disease,Hypopigmentation-punctate palmoplantar keratoderma syndrome,"Cole disease (COLED) is a rare autosomal dominant disorder characterized by congenital or early-onset punctate keratoderma associated with irregularly shaped hypopigmented macules, which are typically",UMLS:C3809781,NCBI:MedGen,NCBI MedGen
UMLS:C0149877,Disease,Hypoglycemic encephalopathy,"Brain damage related to a lowering of blood glucose below a critical level (around 30 mg/dl), which may lead to confusion, lethargy and delirium followed by seizures and coma. Prolonged hypoglycemia m",,NCBI:MedGen,NCBI MedGen
UMLS:C4268170,Disease,"Other Specified Diabetes Mellitus with Stable Proliferative Diabetic Retinopathy, Left Eye",Evidence of other specified diabetes mellitus with stable proliferative diabetic retinopathy in the left eye not specified elsewhere.,,NCBI:MedGen,NCBI MedGen
UMLS:C4268112,Disease,"Type 2 Diabetes Mellitus with Stable Proliferative Diabetic Retinopathy, Right Eye",Evidence of type 2 diabetes mellitus with stable proliferative diabetic retinopathy in the right eye.,,NCBI:MedGen,NCBI MedGen
MONDO:0979235,Disease,"Autoimmune disease, multisystem, infantile-onset, 5",Infantile-onset multisystem autoimmune disease-5 (ADMIO5) is an autosomal recessive disorder characterized predominantly by neonatal-onset type 1 diabetes mellitus due to complete insulin deficiency. ,UMLS:C6012737,NCBI:MedGen,NCBI MedGen
UMLS:C4268035,Disease,"Type 1 Diabetes Mellitus with Proliferative Diabetic Retinopathy with Macular Edema, Right Eye",Evidence of type 1 diabetes mellitus with proliferative diabetic retinopathy with macular edema in the right eye.,,NCBI:MedGen,NCBI MedGen
UMLS:C2874151,Disease,"Other Specified Diabetes Mellitus with Diabetic Neuropathy, Unspecified",Evidence of other specified diabetes mellitus with diabetic neuropathy not specified elsewhere.,,NCBI:MedGen,NCBI MedGen
UMLS:C1842961,Disease,"GLYCOGEN STORAGE DISEASE IV, CHILDHOOD NEUROMUSCULAR",,,NCBI:MedGen,NCBI MedGen
MONDO:0800302,Disease,Glycogen storage disease Id,,UMLS:C0342750,NCBI:MedGen,NCBI MedGen
UMLS:C2874114,Disease,Type 2 Diabetes Mellitus with Diabetic Dermatitis,Evidence of type 2 diabetes mellitus with diabetic dermatitis.,,NCBI:MedGen,NCBI MedGen
UMLS:C4316552,Disease,Carrier of glycogen storage disease,,,NCBI:MedGen,NCBI MedGen
UMLS:C2903669,Disease,"Pre-Existing Type 2 Diabetes Mellitus, in Childbirth",Evidence of pre-existing type 2 diabetes mellitus in childbirth.,,NCBI:MedGen,NCBI MedGen
MONDO:0011678,Disease,Homozygous 11P15-p14 deletion syndrome,,UMLS:C1847866,NCBI:MedGen,NCBI MedGen
UMLS:C1263960,Disease,Coma due to diabetes mellitus,A state of unconsciousness as a complication of diabetes mellitus. It occurs in cases of extreme HYPERGLYCEMIA or extreme HYPOGLYCEMIA as a complication of INSULIN therapy.,,NCBI:MedGen,NCBI MedGen
UMLS:C4268143,Disease,"Other Specified Diabetes Mellitus with Severe Nonproliferative Diabetic Retinopathy with Macular Edema, Bilateral",Evidence of other specified diabetes mellitus with severe nonproliferative diabetic retinopathy with macular edema that is bilateral not specified elsewhere.,,NCBI:MedGen,NCBI MedGen
UMLS:C4268055,Disease,"Type 1 Diabetes Mellitus with Stable Proliferative Diabetic Retinopathy, Right Eye",Evidence of type 1 diabetes mellitus with stable proliferative diabetic retinopathy in the right eye.,,NCBI:MedGen,NCBI MedGen
UMLS:C4268117,Disease,"Type 2 Diabetes Mellitus with Proliferative Diabetic Retinopathy without Macular Edema, Left Eye",Evidence of type 2 diabetes mellitus with proliferative diabetic retinopathy without macular edema in the left eye.,,NCBI:MedGen,NCBI MedGen
UMLS:C2903684,Disease,"Gestational Diabetes Mellitus in Childbirth, Unspecified Control",Evidence of gestational diabetes mellitus in childbirth with unspecified control.,,NCBI:MedGen,NCBI MedGen
MONDO:0017186,Disease,Diazoxide-resistant hyperinsulinism,"A form of congenital isolated hyperinsulism characterized by an excessive/ uncontrolled insulin secretion (inappropriate for the level of glycemia), recurrent episodes of profound hypoglycemia and res",UMLS:C5679778,NCBI:MedGen,NCBI MedGen
UMLS:C4268093,Disease,"Type 2 Diabetes Mellitus with Proliferative Diabetic Retinopathy with Macular Edema, Left Eye",Evidence of type 2 diabetes mellitus with proliferative diabetic retinopathy with macular edema in the left eye.,,NCBI:MedGen,NCBI MedGen
MONDO:0019265,Disease,Diazoxide-resistant focal hyperinsulinism,Diazoxide-resistant focal hyperinsulism (DRFH) is a form of diazoxide-resistant hyperinsulinism characterized by recurrent episodes of profound hypoglycemia caused by an excessive/ uncontrolled insuli,UMLS:C5680204,NCBI:MedGen,NCBI MedGen
UMLS:C4268133,Disease,"Other Specified Diabetes Mellitus with Moderate Nonproliferative Diabetic Retinopathy with Macular Edema, Right Eye",Evidence of other specified diabetes mellitus with moderate nonproliferative diabetic retinopathy with macular edema in the right eye not specified elsewhere.,,NCBI:MedGen,NCBI MedGen
UMLS:C2903696,Disease,"Unspecified Diabetes Mellitus in Pregnancy, First Trimester",Evidence of unspecified diabetes mellitus in pregnancy in the first trimester.,,NCBI:MedGen,NCBI MedGen
UMLS:C2874136,Disease,Other Specified Diabetes Mellitus with Unspecified Diabetic Retinopathy without Macular Edema,Evidence of other specified diabetes mellitus with unspecified diabetic retinopathy without macular edema not specified elsewhere.,,NCBI:MedGen,NCBI MedGen
UMLS:C2874050,Disease,Type 1 Diabetes Mellitus with Other Diabetic Neurological Complication,Evidence of type 1 diabetes mellitus with other diabetic neurological complication.,,NCBI:MedGen,NCBI MedGen
UMLS:C4268150,Disease,"Other Specified Diabetes Mellitus with Proliferative Diabetic Retinopathy with Macular Edema, Left Eye",Evidence of other specified diabetes mellitus with proliferative diabetic retinopathy with macular edema in the left eye not specified elsewhere.,,NCBI:MedGen,NCBI MedGen
MONDO:0013111,Disease,Acute infantile liver failure due to synthesis defect of mtDNA-encoded proteins,"Infants with untreated TRMU deficiency, a mitochondrial disorder, typically become symptomatic between ages two and four months with transient acute liver dysfunction (including elevated transaminases",UMLS:C3278664,NCBI:MedGen,NCBI MedGen
MONDO:0957388,Disease,"Autoimmune disease, multisystem, infantile-onset, 3",Infantile-onset multisystem autoimmune disease-3 (ADMIO3) is an autosomal recessive disorder of immune dysregulation characterized by the onset of various systemic autoimmune manifestations in the fir,UMLS:C5830600,NCBI:MedGen,NCBI MedGen
UMLS:C2825578,Disease,Transferase Deficiency Galactosemia,A disorder characterized by the body''s inability to metabolize galactose. This type of galactosemia is caused by germline mutations in the GALT gene which leads to the inhibition in the activity of t,,NCBI:MedGen,NCBI MedGen
UMLS:C4268126,Disease,"Other Specified Diabetes Mellitus with Mild Nonproliferative Diabetic Retinopathy with Macular Edema, Left Eye",Evidence of other specified diabetes mellitus with mild nonproliferative diabetic retinopathy with macular edema in the left eye not specified elsewhere.,,NCBI:MedGen,NCBI MedGen
UMLS:C6010364,Disease,Diabetes mellitus due to chronic pancreatitis,,,NCBI:MedGen,NCBI MedGen
MONDO:0016789,Disease,Pyruvate metabolism disorder,An inherited metabolic disease that is has its basis in the disruption of pyruvate metabolic process.,UMLS:C0268192,NCBI:MedGen,NCBI MedGen
UMLS:C0268153,Disease,"Classical galactosemia, homozygous Negro-type",,,NCBI:MedGen,NCBI MedGen
MONDO:0017694,Disease,"Glycogen storage disease due to acid maltase deficiency, infantile onset","Glycogen storage disease (GSD) due to acid maltase deficiency, classical infantile onset (AMDI), is the most severe form of glycogen storage disease due to acid maltase deficiency. Characterized by ca",UMLS:C3888924,NCBI:MedGen,NCBI MedGen
MONDO:0859321,Disease,"Mitochondrial complex III deficiency, nuclear type 11","Mitochondrial complex III deficiency nuclear type 11 (MC3DN11) is an autosomal recessive disorder characterized by recurrent episodes of severe lactic acidosis, hyperammonemia, hypoglycemia, and encep",UMLS:C5774259,NCBI:MedGen,NCBI MedGen
UMLS:C5854955,Disease,"Diabetes Mellitus due to Underlying Condition with Severe Non-Proliferative Diabetic Retinopathy without Macular Edema, Left Eye",Evidence of diabetes mellitus due to underlying condition with severe non-proliferative diabetic retinopathy without macular edema in the left eye.,,NCBI:MedGen,NCBI MedGen
UMLS:C2903672,Disease,"Unspecified Pre-Existing Diabetes Mellitus in Pregnancy, First Trimester",Evidence of unspecified pre-existing diabetes mellitus in pregnancy in the first trimester.,,NCBI:MedGen,NCBI MedGen
MONDO:0020858,Disease,"Mitochondrial complex V (ATP synthase) deficiency, nuclear type 5",Any mitochondrial complex deficiency in which the cause of the disease is a mutation in the ATP5F1D gene.,UMLS:C4748269,NCBI:MedGen,NCBI MedGen
UMLS:C3875322,Disease,Hypoglycemia due to type 1 diabetes mellitus,,,NCBI:MedGen,NCBI MedGen
MONDO:0009874,Disease,Rabson-Mendenhall syndrome,INSR-related severe insulin resistance syndrome (INSR-SIRS) comprises a phenotypic spectrum that is a continuum from the severe phenotype of Donohue syndrome to the milder phenotype of Rabson-Mendenha,UMLS:C0271695,NCBI:MedGen,NCBI MedGen
MONDO:0016479,Disease,Silver-Russell syndrome due to 7p11.2p13 microduplication,"Many people with Silver-Russell syndrome have a small, triangular face with distinctive features, including a prominent forehead, a narrow chin, a small jaw, and downturned corners of the mouth. \n\nA",UMLS:C5679840,NCBI:MedGen,NCBI MedGen
MONDO:0010914,Disease,"Carnitine palmitoyl transferase II deficiency, severe infantile form","Carnitine palmitoyltransferase II (CPT II) deficiency is a disorder of long-chain fatty-acid oxidation. The three clinical presentations are lethal neonatal form, severe infantile hepatocardiomuscular",UMLS:C1833511,NCBI:MedGen,NCBI MedGen
UMLS:C5923014,Disease,Stable treated proliferative retinopathy due to diabetes mellitus,,,NCBI:MedGen,NCBI MedGen
UMLS:C4268075,Disease,"Type 2 Diabetes Mellitus with Mild Nonproliferative Diabetic Retinopathy without Macular Edema, Unspecified Eye",Evidence of type 2 diabetes mellitus with mild nonproliferative diabetic retinopathy without macular edema in an unspecified eye.,,NCBI:MedGen,NCBI MedGen
UMLS:C4268003,Disease,"Drug or Chemical Induced Diabetes Mellitus with Proliferative Diabetic Retinopathy without Macular Edema, Left Eye",Evidence of drug or chemical induced diabetes mellitus with proliferative diabetic retinopathy without macular edema in the left eye.,,NCBI:MedGen,NCBI MedGen
UMLS:C5974877,Disease,"Neonatal hypoglycemia, prolonged",,,NCBI:MedGen,NCBI MedGen
UMLS:C4268175,Disease,"Other Specified Diabetes Mellitus with Proliferative Diabetic Retinopathy without Macular Edema, Bilateral",Evidence of other specified diabetes mellitus with proliferative diabetic retinopathy without macular edema that is bilateral not specified elsewhere.,,NCBI:MedGen,NCBI MedGen
MONDO:0100164,Disease,Permanent neonatal diabetes mellitus,Permanent neonatal diabetes mellitus (PNDM) is characterized by the onset of hyperglycemia within the first six months of life (mean age: 7 weeks; range: birth to age 26 weeks). The diabetes mellitus ,UMLS:C1833104,NCBI:MedGen,NCBI MedGen
UMLS:C4268166,Disease,"Other Specified Diabetes Mellitus with Proliferative Diabetic Retinopathy with Combined Traction Retinal Detachment and Rhegmatogenous Retinal Detachment, Bilateral",Evidence of other specified diabetes mellitus with proliferative diabetic retinopathy with combined traction retinal detachment and rhegmatogenous retinal detachment that is bilateral not specified el,,NCBI:MedGen,NCBI MedGen
UMLS:C4268146,Disease,"Other Specified Diabetes Mellitus with Severe Nonproliferative Diabetic Retinopathy without Macular Edema, Left Eye",Evidence of other specified diabetes mellitus with severe nonproliferative diabetic retinopathy without macular edema in the left eye not specified elsewhere.,,NCBI:MedGen,NCBI MedGen
UMLS:C4478635,Disease,Hypoketotic hypoglycemia when fasting,,,NCBI:MedGen,NCBI MedGen
UMLS:C2874086,Disease,Type 2 Diabetes Mellitus with Mild Nonproliferative Diabetic Retinopathy without Macular Edema,Evidence of type 2 diabetes mellitus with mild nonproliferative diabetic retinopathy without macular edema.,,NCBI:MedGen,NCBI MedGen
UMLS:C0948275,Disease,Somogyi phenomenon,,,NCBI:MedGen,NCBI MedGen
UMLS:C2873937,Disease,Diabetes Mellitus due to Underlying Condition with Other Skin Complication,Evidence of diabetes mellitus due to underlying condition with other skin complication.,,NCBI:MedGen,NCBI MedGen
MONDO:0100215,Disease,Rajab interstitial lung disease with brain calcifications 1,Rajab interstitial lung disease with brain calcifications-1 (RILDBC1) is an autosomal recessive multisystem disorder with a highly variable phenotype. Most patients present in infancy or early childho,UMLS:C5436276,NCBI:MedGen,NCBI MedGen
UMLS:C3809554,Disease,"Hyperglycemia, insulin-responsive, episodic",,,NCBI:MedGen,NCBI MedGen
UMLS:C0342301,Disease,Acute hyperglycemia,,,NCBI:MedGen,NCBI MedGen
MONDO:0054781,Disease,Combined oxidative phosphorylation deficiency 36,,UMLS:C4693722,NCBI:MedGen,NCBI MedGen
UMLS:C5786252,Disease,"Drug or Chemical Induced Diabetes Mellitus with Mild Non-Proliferative Diabetic Retinopathy without Macular Edema, Right Eye",Evidence of drug or chemical induced diabetes mellitus with mild non-proliferative diabetic retinopathy without macular edema in the right eye.,,NCBI:MedGen,NCBI MedGen
UMLS:C5786227,Disease,"Diabetes Mellitus due to Underlying Condition with Moderate Non-Proliferative Diabetic Retinopathy with Macular Edema, Bilateral",Evidence of diabetes mellitus due to underlying condition with moderate non-proliferative diabetic retinopathy with macular edema that is bilateral.,,NCBI:MedGen,NCBI MedGen
